{
  "schema_version": "1.0.0",
  "edl_id": "ca3a0e90-9c4f-4df1-812a-844de5d1ad19",
  "project_id": "75870f94-2090-4ceb-9dd7-5313c3524eee",
  "version": 1,
  "parent_version_id": null,
  "created_at": "2026-09-09T05:00:00Z",
  "created_by": { "kind": "user", "id": "creator_001" },
  "source": {
    "asset_id": "asset_source_talkinghead_001",
    "checksum_sha256": "3f7f432a4572f25b4ec0b618047724d6f0481b6eb6fce675b4fcf372727642ef",
    "timebase": "1/90000",
    "duration_seconds": 720.0
  },
  "output": {
    "width": 1080,
    "height": 1920,
    "fps": 30,
    "container": "mp4",
    "video_codec": "h264",
    "audio_codec": "aac",
    "safe_area_preset": "social-vertical-v1"
  },
  "video": {
    "segments": [
      {
        "source_in_seconds": 32.0,
        "source_out_seconds": 62.0,
        "reframe_keyframes": []
      }
    ]
  },
  "captions": {
    "enabled": true,
    "style_template_id": "captions-default-v1",
    "cues": []
  },
  "overlays": [],
  "audio": {
    "source_gain_db": 0,
    "target_lufs": -14,
    "music": []
  },
  "attribution": []
}
